{
  "$schema": "../../schemas/openrazer-native-probe-catalog.schema.json",
  "schema": "hyperflux-openrazer-native-probe-catalog-v1",
  "upstream": {
    "id": "openrazer",
    "repository": "https://github.com/openrazer/openrazer.git",
    "version": "3.12.2",
    "commit": "ddea89607b86023e88563b8feabc8fa2d5773cdd",
    "license_expression": "GPL-2.0-or-later AND CC-BY-SA-4.0"
  },
  "policy_sha256": "35f634e6a6ee688aed8887ddd4abca369822052414605a9e04dcf893c89dd073",
  "inventory_sha256": "0d88389f31c899515e7995a441bbfa12e64aad230caf670060c5b0da12c3e385",
  "report_size": 90,
  "busy_retry": {
    "status": 1,
    "maximum_attempts": 5
  },
  "source_files": [
    {
      "path": "driver/razerchromacommon.c",
      "sha256": "6362884bc962a7dbf9768e6e3c7a1759d913acd4ab8d1bd0bd99d3e401ba4acc"
    },
    {
      "path": "driver/razercommon.h",
      "sha256": "cf7964af6d08f8a33eaad7956e6fd0aa1d251ff397e72a117e2b13ba947ef39f"
    },
    {
      "path": "driver/razerkbd_driver.c",
      "sha256": "08b2582ededa530e304167802c72bdca0c766d912b813bc032735a697a9d61b4"
    },
    {
      "path": "driver/razermouse_driver.c",
      "sha256": "73ea67d5314316ecd59d07dc8def979a1fbcfc5d398a728fed733a8f1f4f31b1"
    }
  ],
  "devices": [
    {
      "profile_id": "child.razer.basilisk-v3-pro-35k.00cd",
      "wireless_identity": {
        "vendor_id": 5426,
        "product_id": 205,
        "model_name": "Razer Basilisk V3 Pro 35K (Wireless)",
        "device_kind": "mouse",
        "transport_variant": "wireless"
      },
      "direct_usb_reference": {
        "vendor_id": 5426,
        "product_id": 204,
        "model_name": "Razer Basilisk V3 Pro 35K (Wired)",
        "device_kind": "mouse",
        "transport_variant": "wired"
      },
      "probes": [
        {
          "method": "get_firmware",
          "privacy": "summary-only",
          "driver": {
            "attribute": "firmware_version",
            "source_path": "driver/razermouse_driver.c",
            "reader": "razer_attr_read_firmware_version",
            "request_owner": "razer_attr_read_firmware_version",
            "source_line": 751,
            "source_sha256": "9031ecacfbb04bbc58d034f4883cb8ee7dcdea3ff96cabfbe55697f06f7b0f9d"
          },
          "request": {
            "command_class": 0,
            "command_id": 129,
            "data_size": 2,
            "arguments": [
              0,
              0
            ],
            "normalized_sha256": "6f515dc63df6f31f2cf56fc146d06f18ba75259c74100eee343106f7c66b33a5",
            "transaction_id_from_upstream": true,
            "crc_recomputed_by_upstream": true
          },
          "response_summary": "firmware-version",
          "comparison": "exact-semantic"
        },
        {
          "method": "get_serial",
          "privacy": "redacted-equality-only",
          "driver": {
            "attribute": "device_serial",
            "source_path": "driver/razermouse_driver.c",
            "reader": "razer_attr_read_device_serial",
            "request_owner": "razer_attr_read_device_serial",
            "source_line": 1320,
            "source_sha256": "2944c301199de96b7daa010af48ccee4b106eda5ce5135bb394a5a207dc73290"
          },
          "request": {
            "command_class": 0,
            "command_id": 130,
            "data_size": 22,
            "arguments": [
              0,
              0,
              0,
              0,
              0,
              0,
              0,
              0,
              0,
              0,
              0,
              0,
              0,
              0,
              0,
              0,
              0,
              0,
              0,
              0,
              0,
              0
            ],
            "normalized_sha256": "1ee6772a2962f0e212d4db1ce62dfc328155bb7e508a50940059c1a89e1afcaf",
            "transaction_id_from_upstream": true,
            "crc_recomputed_by_upstream": true
          },
          "response_summary": "redacted-serial-equality",
          "comparison": "redacted-equality"
        },
        {
          "method": "get_device_mode",
          "privacy": "summary-only",
          "driver": {
            "attribute": "device_mode",
            "source_path": "driver/razermouse_driver.c",
            "reader": "razer_attr_read_device_mode",
            "request_owner": "razer_attr_read_device_mode",
            "source_line": 3850,
            "source_sha256": "e8684b8ae9ce66776b46ea20755c3ba3e77fab21a762015526cb1254289e172b"
          },
          "request": {
            "command_class": 0,
            "command_id": 132,
            "data_size": 2,
            "arguments": [
              0,
              0
            ],
            "normalized_sha256": "0e29a171dc97a2793a7b5d70dd7ffda9b5c27765be31101eb94f15c93aacb515",
            "transaction_id_from_upstream": true,
            "crc_recomputed_by_upstream": true
          },
          "response_summary": "device-mode",
          "comparison": "exact-semantic"
        },
        {
          "method": "get_battery",
          "privacy": "summary-only",
          "driver": {
            "attribute": "charge_level",
            "source_path": "driver/razermouse_driver.c",
            "reader": "razer_attr_read_charge_level",
            "request_owner": "razer_attr_read_charge_level",
            "source_line": 1475,
            "source_sha256": "8d94f4d600d3dc5afb599057d6cbe16ddcea133b2fc82cf580b50859d3b3c4a8"
          },
          "request": {
            "command_class": 7,
            "command_id": 128,
            "data_size": 2,
            "arguments": [
              0,
              0
            ],
            "normalized_sha256": "619cccfff3ef4e128bf0d7a7f3f494ab0f7b3cf0a71d0919d9c57e99fad5e259",
            "transaction_id_from_upstream": true,
            "crc_recomputed_by_upstream": true
          },
          "response_summary": "battery-u8",
          "comparison": "domain-valid"
        },
        {
          "method": "is_charging",
          "privacy": "summary-only",
          "driver": {
            "attribute": "charge_status",
            "source_path": "driver/razermouse_driver.c",
            "reader": "razer_attr_read_charge_status",
            "request_owner": "razer_attr_read_charge_status",
            "source_line": 1573,
            "source_sha256": "c5a80b8e4bbad6a7b26c5e36826dea4574affe3d03b2373f58f09884369e71d2"
          },
          "request": {
            "command_class": 7,
            "command_id": 132,
            "data_size": 2,
            "arguments": [
              0,
              0
            ],
            "normalized_sha256": "71b61f8c9ed82779e8b2be6edcd63f610f82d1fefb4a516242d56bcef616a2c1",
            "transaction_id_from_upstream": true,
            "crc_recomputed_by_upstream": true
          },
          "response_summary": "boolean-u8",
          "comparison": "domain-valid"
        },
        {
          "method": "get_dpi_xy",
          "privacy": "summary-only",
          "driver": {
            "attribute": "dpi",
            "source_path": "driver/razermouse_driver.c",
            "reader": "razer_attr_read_dpi",
            "request_owner": "razer_attr_read_dpi",
            "source_line": 2516,
            "source_sha256": "f28cba39646fcdc401fa8c8e2aa41144cee17ff421fce81d4f30a7d01f32aa3e"
          },
          "request": {
            "command_class": 4,
            "command_id": 133,
            "data_size": 7,
            "arguments": [
              0,
              0,
              0,
              0,
              0,
              0,
              0
            ],
            "normalized_sha256": "7d7beaef2d24499a4e0df524829255f8b9789a3cba830c898952110ddf92a129",
            "transaction_id_from_upstream": true,
            "crc_recomputed_by_upstream": true
          },
          "response_summary": "dpi-xy",
          "comparison": "exact-semantic"
        },
        {
          "method": "get_dpi_stages",
          "privacy": "summary-only",
          "driver": {
            "attribute": "dpi_stages",
            "source_path": "driver/razermouse_driver.c",
            "reader": "razer_attr_read_dpi_stages",
            "request_owner": "razer_attr_read_dpi_stages",
            "source_line": 3048,
            "source_sha256": "8273cc2cf2171434b84736bdd118b9b5e87af59aaa117fd0476abadf64ef5d28"
          },
          "request": {
            "command_class": 4,
            "command_id": 134,
            "data_size": 38,
            "arguments": [
              1,
              0,
              0,
              0,
              0,
              0,
              0,
              0,
              0,
              0,
              0,
              0,
              0,
              0,
              0,
              0,
              0,
              0,
              0,
              0,
              0,
              0,
              0,
              0,
              0,
              0,
              0,
              0,
              0,
              0,
              0,
              0,
              0,
              0,
              0,
              0,
              0,
              0
            ],
            "normalized_sha256": "37d678de6396383525ac9ea8148e3483a1533483b06a1db4ab527b9f97790d98",
            "transaction_id_from_upstream": true,
            "crc_recomputed_by_upstream": true
          },
          "response_summary": "dpi-stages",
          "comparison": "exact-semantic"
        },
        {
          "method": "get_poll_rate",
          "privacy": "summary-only",
          "driver": {
            "attribute": "poll_rate",
            "source_path": "driver/razermouse_driver.c",
            "reader": "razer_attr_read_poll_rate",
            "request_owner": "razer_attr_read_poll_rate",
            "source_line": 1767,
            "source_sha256": "6d7756dc1beccbe14c3d19600cee44937c8c84f6e13d03358be2b8fc849df299"
          },
          "request": {